Name,Email,Company,Job Title,Message,Lead Score,Tier,Industry,Business Need,Recommended Action,Reasoning,Processed At,Error
Mohammed Al Farsi,m.farsi@finedge.ae,FinEdge,CTO,We are currently evaluating AI tools for our finance operations. Budget approved. Need demo ASAP.,90,Hot,Finance,Evaluating AI tools for finance operations with approved budget,Schedule demo,"The lead has a high seniority job title as CTO, clearly describes a specific pain point, and has a strong company fit as a finance company. The message also indicates strong urgency and clear authority with a budget approved, which justifies a high lead score and a recommendation to schedule a demo ASAP.",2026-04-21T10:31:00.550330,False
Aisha Patel,aisha@smartops.io,SmartOps,COO,Our ops team is overwhelmed. We need AI automation immediately. Board approved budget last week.,90,Hot,SaaS,SmartOps needs AI automation to alleviate operational overwhelm,Schedule demo,"The lead is a COO, indicating high seniority and decision-making authority, with a clear and urgent pain point described, and a board-approved budget, making this a high-priority and qualified lead. The mention of 'immediately' and 'last week' also signals strong urgency and a clear timeline for implementation.",2026-04-21T10:31:04.237717,False
Layla Mahmoud,layla@proptech.ae,PropTech,COO,Managing 2000 properties manually. Need automation urgently. Board meeting in 2 weeks to decide vendor.,90,Hot,Real Estate,Automating property management to reduce manual effort and improve efficiency,Schedule demo,"The lead has a clear pain point with manual property management, and the COO title indicates high seniority and decision-making authority. The urgent board meeting in 2 weeks to decide on a vendor also signals strong urgency and budget/authority signals, making this a high-priority lead.",2026-04-21T10:31:34.548392,False
Zara Ahmed,zara@retailedge.ae,RetailEdge,Director of Technology,We have 50 retail stores and need to automate inventory management. Budget is ready. Need this quarter.,88,Hot,Retail,Automate inventory management for 50 retail stores,Schedule demo,"The lead has a senior job title as Director of Technology, scoring 20 points. The message clearly describes a specific pain point and mentions a ready budget, scoring 25 points for message quality and 15 points for budget authority. The company appears to be a mid-size retail business, scoring 15 points for company fit. The lead also expresses a strong sense of urgency, scoring 15 points. Overall, this lead demonstrates a strong fit and clear need for the solution.",2026-04-21T10:31:10.113021,False
Daniel Brown,daniel@cyberguard.io,CyberGuard,CISO,We need AI tools for security threat detection. Compliance deadline in 30 days. Team of 300.,88,Hot,Cybersecurity,Implement AI tools for security threat detection to meet compliance deadline,Schedule demo,"The lead has a high seniority job title as CISO, indicating significant authority, and has clearly described a specific pain point with a strong urgency signal due to a compliance deadline in 30 days. The company size, with a team of 300, also implies a substantial budget and operational scale, making this a high-priority lead.",2026-04-21T10:31:25.747161,False
Sarah Johnson,sarah@brighttech.io,BrightTech,Head of Operations,We need to automate our entire onboarding workflow asap. Currently doing everything manually and it's killing our team's productivity.,85,Hot,SaaS,Automate onboarding workflow to improve team productivity,Schedule demo,"The lead has a clear pain point and is expressing strong urgency to automate their onboarding workflow, indicating a high level of motivation to solve the problem. As the Head of Operations, Sarah has a senior role with likely influence over purchasing decisions. The company name suggests a tech or SaaS industry fit, further increasing the lead's potential.",2026-04-21T10:30:58.214992,False
James Carter,james@scalepro.com,ScalePro,CEO,Looking for automation tools to help us scale. We're evaluating options this week and need something fast.,85,Hot,SaaS,ScalePro needs automation tools to help them scale their business operations,Schedule demo,"The lead is a CEO, indicating high seniority and potential decision-making authority, and has expressed a clear need for automation tools with a sense of urgency, mentioning evaluation this week. The company name ScalePro suggests a tech or SaaS industry, which is a good fit. The message quality is high, with a specific pain point described and a clear timeline for evaluation.",2026-04-21T10:30:59.144520,False
Priya Nair,priya@cloudnest.ai,CloudNest,VP of Engineering,Our deployment pipeline is broken and we need a solution urgently. Team of 50 engineers blocked.,85,Hot,SaaS,"The company needs a solution to fix their broken deployment pipeline, which is currently blocking a team of 50 engineers.",Schedule demo,"The lead has a senior job title as VP of Engineering, which adds 20 points. The message clearly describes a specific pain point and shows strong urgency, adding 25 and 15 points respectively. The company seems to be a tech or SaaS business, which adds 20 points. The mention of a team size implies some level of authority, adding 8 points.",2026-04-21T10:30:59.708748,False
Omar Shaikh,omar@fintechrise.com,FintechRise,CEO,We raised Series A last month. Now scaling operations. Need AI tools to automate compliance reporting.,85,Hot,Finance,FintechRise needs AI tools to automate compliance reporting as they scale operations after raising Series A funding.,Schedule demo,"The lead has a high job title seniority as a CEO, which adds 25 points. The message quality is high, clearly describing a specific pain point, adding 25 points. The company is in the finance industry, specifically a fintech startup, which adds 20 points. The mention of recently raising Series A funding implies a sense of urgency and budget, adding 15 points for strong urgency and 15 points for clear authority.",2026-04-21T10:31:07.827849,False
Kevin Zhang,kevin@datapipe.io,DataPipe,Head of Data,Our data pipeline breaks every week. We need a robust automation solution. This is costing us $50k/month.,85,Hot,SaaS,"DataPipe needs a robust automation solution to fix their frequently breaking data pipeline, which is costing them $50k/month.",Schedule demo,"Kevin Zhang, Head of Data, has a senior job title worth 20 points, and his message clearly describes a specific pain point, worth 25 points. DataPipe appears to be a tech company, which is a good fit, worth 20 points. The mention of a $50k/month cost implies a sense of urgency and clear budget, worth 15 points for urgency and 15 points for budget/authority signals. Overall, this lead shows strong potential and is worth immediate attention.",2026-04-21T10:31:19.106606,False
Mei Lin,mei@edutech.sg,EduTech,CEO,We serve 100k students and need to automate admin tasks. Seed funded. Decision this month.,85,Hot,EduTech,Automate administrative tasks to support 100k students,Schedule demo,"The lead is a CEO, indicating high seniority and decision-making authority, with a clear pain point and specific need for automation. The mention of seed funding and a decision this month also suggests a sense of urgency and budget availability, making this a high-priority lead.",2026-04-21T10:31:28.514740,False
Emma Davis,emma@healthplus.com,HealthPlus,Director of Operations,We need to automate patient onboarding. Compliance is critical. Team of 200. Decision by end of month.,83,Hot,Healthcare,Automate patient onboarding while ensuring compliance,Schedule demo,"The lead has a senior job title as Director of Operations, scoring 20 points. The message clearly describes a specific pain point, scoring 25 points. The company is in the healthcare industry, which is a good fit, scoring 20 points. There is a strong urgency signal with a decision by the end of the month, scoring 15 points. Additionally, the lead mentions a team size and a decision timeline, implying authority, scoring 8 points, but not explicitly mentioning budget, which prevents a higher score.",2026-04-21T10:31:02.595080,False
Fatima Hassan,fatima@logistix.ae,Logistix,VP of Logistics,We manage 500 shipments daily and need automation. Currently using spreadsheets. Urgent need.,83,Hot,Logistics,Automate shipment management to replace manual spreadsheet process,Schedule demo,"The lead has a senior job title as VP of Logistics, indicating a high level of decision-making authority, and has clearly described a specific pain point with their current manual process. The mention of 'urgent need' also signals a strong sense of urgency, suggesting they are actively looking for a solution. The company's industry and the lead's role suggest a good fit for automation solutions.",2026-04-21T10:31:05.369258,False
Nina Kowalski,nina@ecomboost.pl,EcomBoost,Head of E-commerce,Our order processing is manual and slow. We need a solution before the holiday season. Deadline in 6 weeks.,83,Hot,E-commerce,EcomBoost needs to automate their order processing to improve efficiency before the holiday season.,Schedule demo,"The lead has a clear pain point with manual and slow order processing, and a specific deadline in 6 weeks, indicating strong urgency. As the Head of E-commerce, Nina has a senior role, and EcomBoost is in the e-commerce industry, which is a good fit. The message quality is high, with a specific pain point clearly described, and a deadline mentioned, implying some authority.",2026-04-21T10:31:06.936630,False
Isabella Moore,isabella@hrtech.com,HRTech,VP of Product,We are replacing our legacy HR system. Need AI-powered candidate screening. Evaluating now with a team of 5.,83,Hot,SaaS,Replace legacy HR system with AI-powered candidate screening,Schedule demo,"The lead has a senior job title as VP of Product, indicating a high level of decision-making authority, and the company is in the tech industry. The message clearly describes a specific pain point and mentions a current evaluation process with a team, showing strong intent and some urgency. The mention of a team of 5 also implies some level of budget and authority.",2026-04-21T10:31:16.429054,False
Ryan Lee,ryan@devstudio.io,DevStudio,CTO,Building internal tools and exploring AI APIs. No immediate need but interested long term.,70,Warm,SaaS,Exploring AI APIs for internal tool development,Nurture sequence,"The lead is a CTO, indicating high seniority and potential decision-making authority, scoring 25 points. The message is somewhat detailed but lacks a specific pain point, scoring 15 points. The company appears to be a tech or SaaS company, scoring 20 points. There is no strong urgency signal, but the lead does express interest, scoring 0 points for urgency. The lead does not mention budget or authority, scoring 0 points, but as a CTO, some authority is implied, adding a few points. Overall, the lead shows potential but is not ready for immediate action.",2026-04-21T10:31:06.179814,False
Carlos Rivera,carlos@growthly.co,Growthly,Growth Lead,We're scaling fast and need automation tools. Currently evaluating 3 vendors this week.,63,Warm,SaaS,Growthly needs automation tools to support their fast scaling,Schedule demo,"The lead score is 63 due to the company being a scaling startup, the job title of Growth Lead having some seniority, and a clear urgency signal of evaluating vendors this week. The message quality is also decent with some detail about their need for automation tools. However, the score is not higher due to the lack of a clear budget or authority signal and the job title not being at the C-level or VP level.",2026-04-21T10:31:03.537740,False
Sophie Martin,sophie@fashionco.fr,FashionCo,Operations Manager,We need help automating our supply chain. Mid size company. Not super urgent but exploring options.,58,Warm,E-commerce,Automating their supply chain,Nurture sequence,"The lead score is moderate due to the Operations Manager job title, a clear description of their pain point, and a mid-size company. However, the lack of strong urgency signals and no clear budget or authority signals reduces the score. The lead is a good candidate for a nurture sequence to further educate and build trust.",2026-04-21T10:31:22.768674,False
Alex Turner,alex@saasbuilder.io,SaaSBuilder,Founder,We're a early stage startup. No budget yet but very interested in what you offer.,50,Warm,SaaS,The company is looking for a solution but has no budget yet.,Nurture sequence,"The lead is from a SaaS startup, which is a good company fit, and the job title of Founder indicates seniority, but the message lacks a specific pain point and mentions no budget, indicating low urgency and authority signals. The lead shows interest but is not ready for a demo or immediate action.",2026-04-21T10:31:09.186999,False
Lisa Wong,lisa@retailmax.com,RetailMax,Marketing Manager,Interested in your product. Can you send more info?,40,Cold,E-commerce,The company is looking for a product to enhance their marketing efforts.,Nurture sequence,"The lead score is moderate due to the job title of Marketing Manager, which adds 15 points, and the company fit as a retail business, which adds 15 points. However, the message quality is low, adding only 5 points, and there are no urgency or budget/authority signals present, resulting in a relatively low overall score.",2026-04-21T10:31:01.269564,False
Grace Kim,grace@mediahub.com,MediaHub,Content Manager,Looking for tools to help with content scheduling. Not urgent.,30,Cold,Media,Content scheduling tools,Nurture sequence,"The lead score is moderate due to the job title of Content Manager, which indicates some level of influence but not high-level decision-making authority. The message quality is somewhat vague, as it only mentions a general need for content scheduling tools without specific pain points. The company fit is unclear, as MediaHub's industry and operations are not well-defined.",2026-04-21T10:31:08.324977,False
David Smith,david@techwave.io,TechWave,Software Engineer,Just browsing to see what's available.,20,Cold,SaaS,Exploring available solutions,Nurture sequence,"The lead has a low seniority job title as a Software Engineer, scoring 5 points. The message quality is generic, scoring 5 points. The company TechWave seems to be a tech company, scoring 20 points. There are no urgency or budget signals present. Overall, the lead shows some potential due to the company fit, but lacks clear intent or decision-making authority.",2026-04-21T10:31:01.886061,False
Tom Baker,tom@genericmail.com,Unknown Co,Intern,Hey just checking this out for a school project.,10,Cold,Unknown,The lead is researching for a school project and does not have a clear business need.,Disqualify,"The lead is an intern with no clear authority or budget, and the message indicates they are researching for a school project, not a business solution. The company name is also unknown, adding to the uncertainty. Overall, this lead does not show strong potential for conversion.",2026-04-21T10:31:04.748146,False
Ben Wilson,ben@randommail.com,Freelancer,Freelancer,Just curious about AI tools.,10,Cold,Unknown,Exploring AI tools for unknown purposes,Disqualify,"The lead is a freelancer with a generic message, showing no clear pain point, company fit, or urgency. The job title also indicates an individual contributor with likely limited budget and authority.",2026-04-21T10:31:12.633425,False
Jack Harris,jack@spammy.net,SpamCo,Unknown,Hi I want free trial please send me info thanks,10,Cold,Unknown,The lead is looking for a free trial of a product or service.,Disqualify,"The lead's message is generic and lacks detail, with no clear pain point or company information provided. The job title is also unknown, and there are no urgency or budget signals present, indicating a low-quality lead.",2026-04-21T10:31:30.964389,False
